{"detail":"첫 줄에서는 résumé와 café를 검토합니다.\n\tSecond line keeps LF and tab semantics.","due_date":"2026-09-01","format":"workstack.planning-task-snapshot.v1","legacy_task_id":"T-0100","origin_ref":"workstack://11111111-1111-4111-8111-111111111111/planning-tasks/22222222-2222-5222-8222-222222222222","planning_priority":"P2","planning_status":"started","planning_task_uid":"22222222-2222-5222-8222-222222222222","revision":42,"title":"Résumé 🙂 — 검토","workspace_uid":"11111111-1111-4111-8111-111111111111"}
