{"detail":"Explain the desired work without credentials or raw provider traffic.","due_date":null,"format":"workstack.planning-task-snapshot.v1","legacy_task_id":"T-0031","origin_ref":"workstack://0f50a123-3da8-4c82-8f16-8ee1a57260c4/planning-tasks/2e82845c-bccb-5aa6-9b6d-8ec65170c00a","planning_priority":"P1","planning_status":"open","planning_task_uid":"2e82845c-bccb-5aa6-9b6d-8ec65170c00a","revision":3,"title":"Prepare the provider-neutral execution adapter","workspace_uid":"0f50a123-3da8-4c82-8f16-8ee1a57260c4"}
